{
 "counts": {
  "HINT": 292,
  "PAGE": 142,
  "QUESTION": 108,
  "TOPIC": 112
 },
 "generated_at": "2026-10-02T05:47:53Z",
 "generator": {
  "name": "build_search_index",
  "version": "2.0.0"
 },
 "index_digest": "sha256:ef2f62c48c17dba31dea92d7b1ccad180359bc325b0e8784c11aeecd940f74d1",
 "index_version": "2",
 "inputs": {
  "core_learning_digest": "sha256:6bb4a0501eb592ef429b506dababd84c2e17d2d78c9c6da2dd5dd5e399a61142",
  "library_digest": "sha256:1b49adb6123b0bdc63ce9453e7df5abfb5cf8e49e113ebc871b3897090584a9e",
  "pages_digest": "sha256:13bf910a811134dcbfe11c07e3a773e5b140811f1cdc2791311d137146daeed6",
  "question_bank_digest": "sha256:8eba47db4413bcdf07f5890397687542c6d3538aa66d67f07981b9fe9f5c9a78",
  "routes_digest": "sha256:49b9b5517eed829555b567ed0f14235612774f85a5a8e59838b06eb9eeab93fe"
 },
 "questions": {
  "canonical": [
   "PYQ-CHEM-IITJEE-2007-P1-Q39",
   "PYQ-CHEM-IITJEE-2007-P1-Q40",
   "PYQ-CHEM-IITJEE-2007-P1-Q41",
   "PYQ-CHEM-IITJEE-2008-P1-Q66",
   "PYQ-CHEM-IITJEE-2008-P2-Q51",
   "PYQ-CHEM-IITJEE-2009-P1-Q01",
   "PYQ-CHEM-IITJEE-2009-P1-Q04",
   "PYQ-CHEM-IITJEE-2009-P2-Q05",
   "PYQ-CHEM-IITJEE-2009-P2-Q16",
   "PYQ-CHEM-IITJEE-2010-P1-Q16",
   "PYQ-CHEM-IITJEE-2011-P1-Q17",
   "PYQ-CHEM-IITJEE-2011-P1-Q18",
   "PYQ-CHEM-IITJEE-2011-P2-Q01",
   "PYQ-CHEM-IITJEE-2011-P2-Q14",
   "PYQ-CHEM-IITJEE-2012-P2-Q22",
   "PYQ-CHEM-JEEADV-2014-P1-Q29",
   "PYQ-CHEM-JEEADV-2014-P1-Q39",
   "PYQ-CHEM-JEEADV-2015-P1-Q27",
   "PYQ-CHEM-JEEADV-2015-P2-Q25",
   "PYQ-CHEM-JEEADV-2015-P2-Q28",
   "PYQ-CHEM-JEEADV-2016-P1-Q32",
   "PYQ-CHEM-JEEADV-2016-P1-Q34",
   "PYQ-CHEM-JEEADV-2017-P1-Q26",
   "PYQ-CHEM-JEEADV-2018-P1-Q08",
   "PYQ-CHEM-JEEADV-2018-P2-Q08",
   "PYQ-CHEM-JEEADV-2018-P2-Q09",
   "PYQ-CHEM-JEEADV-2019-P2-Q09",
   "PYQ-CHEM-JEEADV-2020-P2-Q03",
   "PYQ-CHEM-JEEADV-2021-P2-Q11",
   "PYQ-CHEM-JEEADV-2021-P2-Q12",
   "PYQ-CHEM-JEEADV-2022-P1-Q04",
   "PYQ-CHEM-JEEADV-2023-P1-Q08",
   "PYQ-CHEM-JEEADV-2023-P2-Q08",
   "PYQ-CHEM-JEEADV-2023-P2-Q10",
   "PYQ-CHEM-JEEADV-2024-P2-Q02",
   "PYQ-CHEM-JEEADV-2025-P1-Q08",
   "PYQ-CHEM-JEEADV-2025-P1-Q12",
   "PYQ-CHEM-JEEADV-2025-P2-Q16",
   "PYQ-CHEM-JEEADV-2026-P1-Q09",
   "PYQ-CHEM-JEEMAIN-2026-04APR-S2-Q62",
   "PYQ-CHEM-JEEMAIN-2026-06APR-S2-Q51",
   "PYQ-CHEM-NEET-2020-E1-Q099",
   "PYQ-CHEM-NEET-2020-E1-Q106",
   "PYQ-CHEM-NEET-2020-E1-Q110",
   "PYQ-CHEM-NEET-2020-E1-Q123",
   "PYQ-CHEM-NEET-2020-E1-Q125",
   "PYQ-PHY-IITJEE-2007-P1-Q03",
   "PYQ-PHY-IITJEE-2007-P1-Q10",
   "PYQ-PHY-IITJEE-2008-P2-Q32",
   "PYQ-PHY-IITJEE-2008-P2-Q33",
   "PYQ-PHY-IITJEE-2009-P1-Q49",
   "PYQ-PHY-IITJEE-2009-P2-Q40",
   "PYQ-PHY-IITJEE-2009-P2-Q55",
   "PYQ-PHY-IITJEE-2011-P1-Q41",
   "PYQ-PHY-IITJEE-2011-P2-Q26",
   "PYQ-PHY-IITJEE-2011-P2-Q33",
   "PYQ-PHY-IITJEE-2011-P2-Q34",
   "PYQ-PHY-IITJEE-2012-P1-Q05",
   "PYQ-PHY-JEEADV-2013-P1-Q07",
   "PYQ-PHY-JEEADV-2014-P1-Q08",
   "PYQ-PHY-JEEADV-2014-P1-Q11",
   "PYQ-PHY-JEEADV-2014-P1-Q18",
   "PYQ-PHY-JEEADV-2014-P2-Q19",
   "PYQ-PHY-JEEADV-2018-P2-Q08",
   "PYQ-PHY-JEEADV-2019-P2-Q09",
   "PYQ-PHY-JEEADV-2020-P1-Q13",
   "PYQ-PHY-JEEADV-2021-P1-Q05",
   "PYQ-PHY-JEEADV-2021-P1-Q06",
   "PYQ-PHY-JEEADV-2022-P1-Q08",
   "PYQ-PHY-JEEADV-2023-P1-Q01",
   "PYQ-PHY-JEEADV-2024-P2-Q09",
   "PYQ-PHY-JEEADV-2025-P2-Q15",
   "PYQ-PHY-JEEADV-2026-P1-Q06",
   "PYQ-PHY-JEEMAIN-2026-04APR-S2-Q27",
   "PYQ-PHY-JEEMAIN-2026-04APR-S2-Q29",
   "PYQ-PHY-JEEMAIN-2026-06APR-S2-Q46",
   "PYQ-PHY-NEET-2020-E1-Q160",
   "Q-AUTHOR-REL-01",
   "Q-ELEC-1A-CONSERVATION-01",
   "Q-ELEC-1A-OHMIC-01",
   "Q-ELEC-2A-CONSERVATION-01",
   "Q-ELEC-2B-OHMIC-01",
   "Q-MAT-LEQ-01-1A-EVALUATE-SIDES",
   "Q-MAT-LEQ-01-1A-ONE-VALUE-NOT-ALL",
   "Q-MAT-LEQ-01-EXEMPLAR8-Q17",
   "Q-MAT-LEQ-01-EXEMPLAR8-Q20",
   "Q-MAT-LEQ-01-EXEMPLAR8-Q6",
   "Q-MAT-LEQ-02-1A-COLLECT-TERMS",
   "Q-MAT-LEQ-02-1A-DIVIDE-AND-CHECK",
   "Q-MAT-LEQ-02-EXEMPLAR9-4-1-Q16",
   "Q-MAT-LEQ-02-NCERT8-EX2-1-Q1",
   "Q-MAT-LEQ-02-NCERT8-EX2-1-Q2",
   "Q-MAT-LEQ-02-NCERT8-EX2-1-Q3",
   "Q-MAT-LEQ-02-NCERT8-EX2-1-Q5",
   "Q-MAT-LEQ-03-1A-CLEAR-DENOMINATORS",
   "Q-MAT-LEQ-03-1A-OPEN-BRACKETS",
   "Q-MAT-LEQ-03-1A-VARIABLE-VANISHES",
   "Q-MAT-LEQ-03-EXEMPLAR8-Q58",
   "Q-MAT-LEQ-03-EXEMPLAR8-Q61",
   "Q-MAT-LEQ-03-NCERT8-EX2-2-Q10",
   "Q-MAT-LEQ-03-NCERT8-EX2-2-Q7",
   "Q-MAT-LEQ-03-NCERT8-EX2-2-Q9",
   "Q-MAT-LEQ-04-1A-GENERATE-PAIRS",
   "Q-MAT-LEQ-04-1A-READ-THE-LINE",
   "Q-MAT-LEQ-04-1A-TEST-PAIRS",
   "Q-MAT-LEQ-04-EXEMPLAR9-4-1-Q1",
   "Q-MAT-LEQ-04-EXEMPLAR9-4-1-Q11",
   "Q-MAT-LEQ-04-EXEMPLAR9-4-1-Q3",
   "Q-MAT-LEQ-04-EXEMPLAR9-4-2-Q1",
   "Q-MAT-LEQ-04-EXEMPLAR9-4-3-Q7",
   "Q-MATH-CONSTRAINT-1A",
   "Q-MATH-EXACT-1A",
   "Q-MATH-LINEAR-01",
   "Q-MATH-LINEAR-2B-01",
   "Q-OSC-1A-ENERGY-01",
   "Q-OSC-1A-EQUIL-01",
   "Q-OSC-2A-EQUIL-01",
   "Q-OSC-2B-ENERGY-01",
   "Q-PHY-GRAV-2A-01",
   "Q-PHY-KIN-2A-01",
   "Q-PHY-KIN-2A-COV-02",
   "Q-PHY-KIN-2A-COV-03",
   "Q-PHY-KIN-2A-COV-04",
   "Q-PHY-KIN-2A-COV-05",
   "Q-PHY-KIN-2D-1A-CONSTANT-ACCEL-01",
   "Q-PHY-KIN-2D-1A-SHARED-CLOCK-01",
   "Q-PHY-KIN-2D-2A-CONSTANT-ACCEL-02",
   "Q-PHY-KIN-2D-2A-HORIZONTAL-LAUNCH-04",
   "Q-PHY-KIN-2D-2A-PROJECTILE-APEX-03",
   "Q-PHY-KIN-2D-2A-SAME-HEIGHT-05",
   "Q-PHY-KIN-2D-2A-SHARED-CLOCK-01",
   "Q-PHY-KIN-2D-2B-MODEL-VALIDITY-02",
   "Q-PHY-KIN-2D-2B-PROJECTILE-VALIDITY-04",
   "Q-PHY-KIN-2D-2B-REPRESENTATION-01",
   "Q-PHY-KIN-2D-2B-SAME-HEIGHT-VELOCITY-05",
   "Q-PHY-KIN-2D-2B-UNEQUAL-HEIGHT-03",
   "Q-PHY-KIN-CIRC-2A-FORCE-ROLE-01",
   "Q-PHY-KIN-CIRC-2B-FLAT-CURVE-02",
   "Q-PHY-KIN-CIRC-2B-VERTICAL-03",
   "Q-PHY-KIN-PRACTICAL-13",
   "Q-PHY-KIN-PROJ-1A-EVENTS-01",
   "Q-PHY-KIN-PROJ-1A-MODEL-01",
   "Q-PHY-KIN-PROJ-1A-UNEQUAL-01",
   "Q-PHY-KIN-VERT-2A-APEX-05",
   "Q-PHY-KIN-VERT-2A-DOWN-AXIS-04",
   "Q-PHY-KIN-VERT-2A-DROP-02",
   "Q-PHY-KIN-VERT-2A-RETURN-03",
   "Q-PHY-KIN-VERT-2A-UPWARD-01",
   "Q-PHY-KIN-VERT-2B-BALCONY-02",
   "Q-PHY-KIN-VERT-2B-DIRECTION-SWITCH-04",
   "Q-PHY-KIN-VERT-2B-REVERSED-AXIS-01",
   "Q-PHY-KIN-VERT-2B-SAME-HEIGHT-03",
   "Q-PHY-KIN-VERT-2B-VT-GRAPH-05",
   "Q-PHY-MACHINE-2A-01",
   "Q-PHY-MACHINE-PRACTICAL-11",
   "Q-PHY-NLM-1A-CANCEL-01",
   "Q-PHY-NLM-1A-CONNECTED-BODIES-01",
   "Q-PHY-NLM-1A-CONSTRAINT-TENSION-01",
   "Q-PHY-NLM-1A-ELEVATOR-FRAMES-01",
   "Q-PHY-NLM-1A-FBD-OWNERSHIP-01",
   "Q-PHY-NLM-1A-FRICTION-DIRECTION-01",
   "Q-PHY-NLM-1A-FRICTION-TEST-01",
   "Q-PHY-NLM-1A-NET-ZERO-01",
   "Q-PHY-NLM-1A-SECOND-LAW-01",
   "Q-PHY-NLM-1A-STRING-FBD-01",
   "Q-PHY-NLM-1A-STRING-LENGTH-01",
   "Q-PHY-NLM-1A-SYSTEM-CHOICE-01",
   "Q-PHY-NLM-1A-TENSION-VALUE-01",
   "Q-PHY-NLM-1A-THIRD-LAW-01",
   "Q-PHY-NLM-2A-01",
   "Q-PHY-NLM-2A-ATWOOD-12",
   "Q-PHY-NLM-2A-CONNECTED-02",
   "Q-PHY-NLM-2A-CONNECTED-CONSTRAINT-11",
   "Q-PHY-NLM-2A-COV-02",
   "Q-PHY-NLM-2A-COV-03",
   "Q-PHY-NLM-2A-COV-04",
   "Q-PHY-NLM-2A-COV-05",
   "Q-PHY-NLM-2A-COV-06",
   "Q-PHY-NLM-2A-FIXED-PULLEY-04",
   "Q-PHY-NLM-2A-FRAME-CHOICE-07",
   "Q-PHY-NLM-2A-FRICTION-KINETIC-10",
   "Q-PHY-NLM-2A-FRICTION-STATIC-09",
   "Q-PHY-NLM-2A-FRICTION-THRESHOLD-01",
   "Q-PHY-NLM-2A-FRICTION-ZERO-08",
   "Q-PHY-NLM-2A-IDEAL-STRING-03",
   "Q-PHY-NLM-2B-CONNECTED-SYSTEM-02",
   "Q-PHY-NLM-2B-CONSTRAINT-VS-TENSION-07",
   "Q-PHY-NLM-2B-CONTACT-LOSS-06",
   "Q-PHY-NLM-2B-FRAME-SELECTION-05",
   "Q-PHY-NLM-2B-FRICTION-ANGLED-THRESHOLD-04",
   "Q-PHY-NLM-2B-FRICTION-STATE-01",
   "Q-PHY-NLM-2B-FRICTION-TOP-BLOCK-05",
   "Q-PHY-NLM-2B-FRICTION-WALKING-02",
   "Q-PHY-NLM-2B-FRICTION-ZERO-03",
   "Q-PHY-NLM-2B-PULLEY-REPRESENTATION-04",
   "Q-PHY-NLM-2B-STRING-MODEL-03",
   "Q-PHY-NLM-INCLINE-2A-FBD-COMPONENTS-05",
   "Q-PHY-NLM-INCLINE-2A-HORIZONTAL-PUSH-04",
   "Q-PHY-NLM-INCLINE-2A-SLIDING-03",
   "Q-PHY-NLM-INCLINE-2A-SMOOTH-01",
   "Q-PHY-NLM-INCLINE-2A-STATIC-02",
   "Q-PHY-NLM-INCLINE-2B-AXES-01",
   "Q-PHY-NLM-INCLINE-2B-COMPONENT-TRAP-04",
   "Q-PHY-NLM-INCLINE-2B-FRICTION-DIRECTION-02",
   "Q-PHY-NLM-INCLINE-2B-HORIZONTAL-THRESHOLD-03",
   "Q-PHY-NLM-INCLINE-2B-TIMING-05",
   "Q-PHY-NLM-MTR-2A-01",
   "Q-PHY-NLM-MTR-2A-02",
   "Q-PHY-NLM-MTR-2A-03",
   "Q-PHY-NLM-MTR-2A-04",
   "Q-PHY-NLM-MTR-2A-05",
   "Q-PHY-NLM-MTR-2B-AVERAGE-05",
   "Q-PHY-NLM-MTR-2B-LOG-02",
   "Q-PHY-NLM-MTR-2B-MODEL-01",
   "Q-PHY-NLM-MTR-2B-SUPPORT-03",
   "Q-PHY-NLM-MTR-2B-ZERO-04",
   "Q-PHY-NLM-PRACTICAL-12",
   "Q-PHY-SOUND-2A-01",
   "Q-PHY-SOUND-2A-COV-02",
   "Q-PHY-SOUND-2A-COV-03",
   "Q-PHY-SOUND-2A-COV-04",
   "Q-PHY-SOUND-PRACTICAL-10",
   "Q-PHY-VEC-DECOMP-2A-FROM-X-01",
   "Q-PHY-VEC-DECOMP-2A-FROM-Y-02",
   "Q-PHY-VEC-DECOMP-2A-INITIAL-STATE-05",
   "Q-PHY-VEC-DECOMP-2A-QUADRANT-II-03",
   "Q-PHY-VEC-DECOMP-2A-QUADRANT-IV-04",
   "Q-PHY-VEC-DECOMP-2B-ALREADY-COMPONENTS-02",
   "Q-PHY-VEC-DECOMP-2B-COMPLEMENTARY-ANGLES-03",
   "Q-PHY-VEC-DECOMP-2B-FORCE-CONTEXT-04",
   "Q-PHY-VEC-DECOMP-2B-REVERSED-X-AXIS-05",
   "Q-PHY-VEC-DECOMP-2B-VERBAL-NW-01",
   "Q-PHY-VECOPS-2A-01",
   "Q-PHY-VECREP-2A-01",
   "Q-PHY-WEP-2A-01",
   "Q-PHY-WEP-2A-COV-02",
   "Q-PHY-WEP-2A-COV-03",
   "Q-PHY-WEP-2A-COV-04",
   "Q-PHY-WEP-2A-COV-05",
   "Q-PHY-WEP-2A-DERIV-01",
   "Q-PHY-WEP-PRACTICAL-09",
   "Q-VDU-1A-DIRECTION-01",
   "Q-VDU-1A-NOTATION-01",
   "Q-VDU-1A-UNIT-01",
   "Q-VDU-2A-NOTATION-01",
   "Q-VDU-2B-DIRECTION-01"
  ],
  "excluded": [],
  "routed": [
   "PYQ-CHEM-IITJEE-2007-P1-Q39",
   "PYQ-CHEM-IITJEE-2007-P1-Q40",
   "PYQ-CHEM-IITJEE-2007-P1-Q41",
   "PYQ-CHEM-IITJEE-2008-P1-Q66",
   "PYQ-CHEM-IITJEE-2008-P2-Q51",
   "PYQ-CHEM-IITJEE-2009-P1-Q01",
   "PYQ-CHEM-IITJEE-2009-P1-Q04",
   "PYQ-CHEM-IITJEE-2009-P2-Q05",
   "PYQ-CHEM-IITJEE-2009-P2-Q16",
   "PYQ-CHEM-IITJEE-2010-P1-Q16",
   "PYQ-CHEM-IITJEE-2011-P1-Q17",
   "PYQ-CHEM-IITJEE-2011-P1-Q18",
   "PYQ-CHEM-IITJEE-2011-P2-Q01",
   "PYQ-CHEM-IITJEE-2011-P2-Q14",
   "PYQ-CHEM-IITJEE-2012-P2-Q22",
   "PYQ-CHEM-JEEADV-2014-P1-Q29",
   "PYQ-CHEM-JEEADV-2014-P1-Q39",
   "PYQ-CHEM-JEEADV-2015-P1-Q27",
   "PYQ-CHEM-JEEADV-2015-P2-Q25",
   "PYQ-CHEM-JEEADV-2015-P2-Q28",
   "PYQ-CHEM-JEEADV-2016-P1-Q32",
   "PYQ-CHEM-JEEADV-2016-P1-Q34",